,title,view,like,unlike,date
0,ENG SUB 우울한 나를 위로하는 방법에 대한 고민 여러분들은 어떤가요빙고트립 EP5Bingo Trip위너WINNER,조회수 30374회,3.3천,8,20시간 전 최초 공개
1,이제 노래까지 노부부케미 폭발하는 다비치의 나의 오랜연인에게를 8D라이브로 8D Audio 라이브/이어폰서트 4K,조회수 28651회,1.4천,2,2019. 12. 6.
2,비하인드/EVENT 세정SEJEONG X 딩고 촬영 현장 폴라로이드 | 딩고가 만난 김클린 | 터널Tunnel | dingomusic,조회수 11256회,913,0,2019. 12. 6.
3,저세상 텐션으로 대환장파티 열고 간 아스트로  ASTRO - BLUE FLAME |ROLLER COASTER DANCE,조회수 106538회,1.4만,25,2019. 12. 6.
4,ENG SUB 괜찮아 너 잘 하고 있어 | 세정SEJEONG - 터널 | TUNNEL | 4K | VISUAL FILM dingotunes | dingomusic,조회수 79773회,7.9천,18,2019. 12. 6.
5,첫 눈 연금 들러 온 발라드 세손-정승환☃️십이월 이십오일의 고백My christmas wish8D Audio 라이브/이어폰서트 4K,조회수 54921회,3천,11,2019. 12. 6.
6,ENG SUB 재생버튼 누르는 순간 계속 빵빵 터지는 역대급 빅톤의 고요속의 외침 영상ㅋㅋㅋ | 빅톤 의리게임 | EP4 | 딩고뮤직 | Dingo Music | VICTON,조회수 87865회,7.5천,15,2019. 12. 5.
7,지치고 힘든 날 듣기 좋은 세정의 위로곡 BEST5 | 한숨 하루의 끝 꽃길 터널 U R | 4K | dingomusic,조회수 187481회,1.5만,40,2019. 12. 4.
8,ENG SUB 꽉 막힌 하루 끝에서 널 기다릴게 | 세정SEJEONG - 터널 | SERO LIVE | 4K | Tunnel | dingomusic,조회수 533103회,3.2만,140,2019. 12. 2.
9,ENG SUB 세정 SEJEONG ‘터널 Tunnel’ Lyric Video Teaser리릭비디오 티저딩고뮤직Dingo Music,조회수 36567회,3천,5,2019. 12. 1.
10,설현이 춤추다가 빵 터진 이유는에이오에이 - AOA 날 보러와요음향사고딩고뮤직dingomusic,조회수 352563회,8.8천,77,2019. 11. 30.
11,ENG SUB 꽃길 이후 3년만에 솔로곡 발표하는 김세정 | 세정SEJEONG - 터널 | Tunnel | TEASER | dingomusic,조회수 83982회,4.8천,19,2019. 11. 30.
12,ENG SUB SOSO하게 백일장 할랬더니 아무말페스티벌 열려버린 위너빙고트립 EP4Bingo Trip위너WINNER,조회수 53174회,5천,15,최초 공개: 2019. 11. 29.
13,ENG SUB 데뷔 후 처음으로 손절 직전까지 치열하게 싸운 그들  | 빅톤 의리게임 | EP3 | 딩고뮤직 | Dingo Music | VICTON,조회수 94297회,7.1천,17,2019. 11. 29.
14,AOA - 날 보러 와요 Come See Me | Performance video 4K | MOVE REC | DINGO MUSIC,조회수 330404회,2.3만,160,2019. 11. 28.
15,ENG SUB 위로가 필요한 당신에게 전하는 세정의 따뜻한 한마디 자기전에  | 세정SEJEONG | 터널 | DINGO MUSIC,조회수 47886회,3천,12,2019. 11. 28.
16,노을 Noel - 늦은 밤 너의 집 앞 골목길에서 Late Night세로라이브딩고뮤직Dingo Music,조회수 174891회,2.5천,72,2019. 11. 26.
17,유빈 Yubin - 무성영화 Feat윤미래세로라이브딩고뮤직Dingo Music,조회수 32207회,1.2천,20,2019. 11. 24.
18,이슬라이브  자이언티 - 5월의 밤 May | 낮술 한 잔 땡기고 듣는 꺼내먹어요 + 신곡 | Tipsy Live | 딩고뮤직,조회수 150920회,1.5천,32,2019. 11. 23.
19,ENG SUB 위너가 잠든 후에  여기 자면서도 미모 열일하는 꽃도령 있음 빙고트립 EP3Bingo Trip위너WINNER,조회수 100724회,7.7천,21,최초 공개: 2019. 11. 22.
20,4K 아스트로 ASTRO - BLUE FLAME | Performance video | MOVE REC,조회수 325282회,3.2만,66,2019. 11. 21.
21,ENG SUB 데뷔 후 역대급 모습으로 휴게소에 나타난 아이돌 | 빅톤 의리게임 | EP2 | 딩고뮤직 | Dingo Music | VICTON,조회수 115051회,8.1천,11,2019. 11. 21.
22,Crush - 그냥 Just크러쉬DF CAMDingo Music딩고뮤직,조회수 75041회,3.5천,13,2019. 11. 20.
23,에이틴 주하가 본업 중에 멍 때린 이유는골든차일드 Golden Child - WANNA BE음향사고딩고뮤직dingomusic,조회수 104459회,7.9천,13,2019. 11. 20.
24,4K 우주소녀 WJSN - 이루리 As You Wish  | choreography | MOVE REC,조회수 204584회,1.4만,82,2019. 11. 20.
25,막내가 33살이라는 어느 걸그룹매력 터져버리는 브아걸 | Zip터뷰 |,조회수 249258회,5천,37,2019. 11. 16.
26,ENG SUB 힐링잔치 열어줬더니 웃음참기 챌린지를 하는 아이돌이 있다빙고트립 EP2Bingo Trip위너WINNER,조회수 136500회,1만,33,최초 공개: 2019. 11. 15.
27,ENG SUB 오랜만에 딩고 와서 멤버들의 모든 비밀 탈탈 털고 간 아이돌 | 빅톤 의리게임 | EP1 | 딩고뮤직 | Dingo Music,조회수 208371회,1.3만,31,2019. 11. 14.
28,Crush - 나빠 NAPPA크러쉬DF CAMDingo Music딩고뮤직,조회수 111944회,6.6천,19,2019. 11. 12.
29,딩고가 나라를 세우면 생기는 일 feat1위 가수 빅톤 | VICTON | 의리게임 시즌2 | 딩고뮤직 | Dingo Music,조회수 55675회,5.3천,10,2019. 11. 12.
30,밴디트BVNDIT - Dumb | Performance Video 5K | MOVE REC,조회수 58705회,5.4천,24,2019. 11. 11.
31,지코ZICO - 남겨짐에 대해 Feat 다운세로라이브딩고뮤직Dingo Music,조회수 124692회,6.1천,44,2019. 11. 10.
32,1년 6개월만에 컴백하는 빅톤의 이야기  | VICTON | 딩고뮤직 | Dingo Music,조회수 110288회,9.6천,28,2019. 11. 9.
33,ENG SUB 우린 이제 딩고가 무서워요 힐링에 미쳐버린 딩고가 위너에게 무슨 짓을빙고트립 EP1Bingo Trip위너WINNER,조회수 171498회,1.3만,30,최초 공개: 2019. 11. 8.
34,ENG SUB데뷔 6년차 그룹 '위너WINNER'의 이야기 | 위너 | WINNER | 빙고트립 | TEASER,조회수 60795회,6.5천,19,2019. 11. 8.
35,5K 현아HyunA - FLOWER SHOWER  | choreography |  MOVE REC,조회수 512709회,3.9만,198,2019. 11. 7.
36,5K 던DAWN - Money  | choreography | MOVE REC,조회수 329497회,2.6만,144,2019. 11. 6.
37,⭐️천상계 비주얼⭐️아련미 폭발하는 빅톤-그리운 밤5K | nostalsic night | VICTON | choreography | MOVE REC,조회수 170641회,1.9만,23,2019. 11. 5.
38,딩고도 빅톤이 보고싶은 그리운 밤 | VICTON |,조회수 17448회,1.8천,4,2019. 11. 4.
39,Jeremy Zucker제레미주커 - comethru | 세로라이브 | 딩고뮤직 | Dingo Music,조회수 201563회,1.6만,20,2019. 11. 3.
40,딩고는 이제 내기를 안한다고요 아시겠어요 | 위너 | WINNER | 빙고트립 | TEASER,조회수 42349회,3.9천,8,2019. 11. 1.
41,회식라이브 정키랑 녹음한 썰 풀다가 욱한 양다일 양다일 빈센트블루 - 오늘이 지나면 | Tipsy Live | 딩고뮤직,조회수 34842회,786,8,2019. 10. 30.
42,양다일 노래 부르는데 본인 등판해서 같이 부름 ㄷㄷㄷ | 빈센트블루Vincent Blue | 오늘이 지나면 | 버스킹 어택 | 딩고뮤직 | dingomusic,조회수 32800회,613,12,2019. 10. 28.
43,8D Audio 라이브/이어폰서트 양다일 빈센트블루Vincent Blue - 오늘이 지나면 4K | Earphonecert | dingomusic,조회수 176420회,2.4천,50,2019. 10. 27.
44,4K 신곡 최초공개 @STAGE with 브라운아이드걸스｜브아걸｜클렌징크림 다가와서 LOVE sign abracadabra Sixth sense원더우먼｜딩고뮤직,조회수 1233910회,4.9만,183,2019. 10. 26.
45,양다일 앞에서 서울예대 합격곡 Brown Sugar 부른 빈센트블루Vincent Blue | 아소토유니온또라이김건모서울의달이문세 | 레전드 입시곡 | dingomusic,조회수 98884회,2.6천,15,2019. 10. 26.
46,⭐최초 선공개⭐ 가인 - 사랑밖엔 난 몰라브라운 아이드 걸스브아걸세로라이브딩고뮤직Dingo Music,조회수 214639회,6.3천,41,2019. 10. 25.
47,서울예대 실용음악과 합격곡으로 현장 찢은 양다일Brian Mcknight-Father 박효신-연인처음 느낌 그대로사랑이 다른 사랑으로 잊혀지네넬-마음을 잃다레전드 입시곡,조회수 616878회,8.6천,137,2019. 10. 25.
48,4K 위너의 미니콘서트｜@STAGE with WINNER위너｜MILLIONS AH YEAH 아예 OMG SOSO｜딩고뮤직｜Dingo Music,조회수 524706회,4.8만,146,2019. 10. 24.
49,레전드 입시곡 부르러 서울예대 실음과 찾아간 양다일 빈센트블루Vincent Blue | TEASER | dingomusic,조회수 34570회,416,8,2019. 10. 24.
50,노래 듣자마자 양다일이 바로 연락했다는 천재 싱어송라이터 | Vincent Blue 빈센트블루 딩고하이,조회수 13444회,399,1,2019. 10. 23.
51,8D Audio 라이브/이어폰서트 폴킴의 목소리+숨소리 하나하나까지 생생하게 들리는 8D 라이브 '허전해',조회수 311014회,7.6천,55,2019. 10. 22.
52,팬들을 생각하며 잘 이겨낸 레이디스 코드의 따뜻한 팬송 'NEVER ENDING STORY' 세로라이브 4K I 딩고뮤직,조회수 30166회,1.2천,3,2019. 10. 21.
53,8D Audio 라이브/이어폰서트 AKMU악동뮤지션 - 어떻게 이별까지 사랑하겠어 널 사랑하는 거지 4K | Earphonecert | dingomusic,조회수 2497214회,8.5만,440,2019. 10. 19.
54,8D Audio 라이브/이어폰서트 나만을 위해 속삭이듯 노래 불러주는 오반의 감성 신곡 ‘전화를 할까봐’,조회수 89601회,2.1천,35,2019. 10. 17.
55,SURL 설 - 옥상에서 춤을BGM LIVE웹드라마 '라이크LIKE' OST딩고뮤직dingomusic,조회수 85155회,1.3천,25,2019. 10. 10.
56,TEASER SURL 설 - 옥상에서 춤을BGM LIVE웹드라마 '라이크' OST딩고뮤직dingomusic,조회수 6456회,151,5,2019. 10. 9.
57,8D Audio 라이브/이어폰서트 세상 소름돋는 라이브로 귀를 간지럽히는 이바다의 신곡 ’ㅎㅇ’,조회수 96805회,2.2천,19,2019. 10. 8.
58,8D Audio 라이브/이어폰서트 신개념 라이브 백지영이 귓가에 속삭이듯 노래 불러주는 것 같은 '우리가We',조회수 181172회,3천,40,2019. 10. 7.
59,용주YONGZOO - 그게 좋더라구 Cause it’s you | 설렘주의흔한 남사친의 담백한 고백송 | 세로라이브 | SERO LIVE | 딩고뮤직,조회수 14577회,532,4,2019. 10. 2.
60,세븐틴 부승관의 유튜'부' 흑돼지 먹방 ASMR｜빙고트립 비하인드｜딩고뮤직,조회수 57596회,7천,19,2019. 10. 2.
61,❤️씹덕 + 귀여움 + 잘생김 대파티 ❤️셉둥이들 모음zip | 6:20 세븐틴SEVENTEEN-독 one take ver |,조회수 299726회,2.4만,64,2019. 10. 1.
62,양팡X키썸이 부른 대환장의 ‘슈퍼스타’  왜 거기서 나와 LIVE 4K I 딩고뮤직,조회수 793499회,2.1만,535,최초 공개: 2019. 9. 26.
63,다비치 이해리 Lee Hae Ri - 나만 아픈 일 Heartache세로라이브SERO LIVE딩고뮤직dingomusic,조회수 122437회,2.7천,18,2019. 9. 26.
64,양팡X키썸 환장의 콜라보 ,조회수 28637회,658,44,2019. 9. 25.
65,멜로망스 김민석Kim MinSeok - 다 생각나서My Love세로라이브SERO LIVE딩고뮤직dingomusic,조회수 62611회,821,15,2019. 9. 25.
66,키썸이 발굴한 인재와 뭘 했을까나 ,조회수 18869회,346,6,2019. 9. 23.
67,자기만 부를 수 있는 노래 누워서 부른 갓창정 세로라이브 임창정 - 십삼월 IM CHANG JUNG - Never ending,조회수 196076회,4.3천,59,2019. 9. 19.
68,심장에 엄청난 무리가 오는 영상 5K SEVENTEEN세븐틴 - 독 : Fear | choreography | MOVE REC,조회수 919445회,8.6만,145,2019. 9. 16.
69,pH-1 치즈 운전실력에 동공지진  I 드라이브하며 듣기 좋은 CHEEZE & pH-1 - Blue Champagne I 블루샴페인 | 어디갈래 I dingomusic,조회수 76902회,2천,14,2019. 9. 10.
70,치즈치원이 팬이면 이리온♀️♂️ | CHEEZE & pH-1-Blue Champagne 블루샴페인 LIVE | 깜짝음감회 | dingomusic | 딩고뮤직,조회수 62912회,1.7천,12,2019. 9. 6.
71,🥂블루샴페인 만들다 벌어진 pH-1 치즈CHEEZE 폭로전 이상형 연예인과 주량 심리분석가 치원이 등장한 사연은 l 근본없는 인터뷰 | Blue Champagne,조회수 134326회,3천,20,2019. 9. 5.
72,CHEEZE치즈 pH-1 - Blue Champagne 블루샴페인세로라이브SERO LIVE딩고뮤직dingomusic,조회수 229879회,4.7천,53,2019. 9. 4.
73,에이핑크 하영이가 춤추는데 웃고 있던 이유는오하영 에이핑크 - Don`t Make Me Laugh음향사고딩고뮤직dingomusic,조회수 81803회,3.8천,29,2019. 9. 3.
74,🧀치즈CHEEZE의 갓띵곡 모음🧀 | 신곡 Blue Champagne 블루샴페인 마들렌 러브 Be There 우린 어디에나 어떻게 생각해 | LIVE PACK |,조회수 118205회,4.6천,26,2019. 9. 3.
75,4K 역대급 끈적한 음향사고 찍어버린 CIX | MOVIE STAR ROLLER COASTER DANCE,조회수 311452회,2.5만,86,2019. 9. 2.
76,VLOG | 핵다른 뮤지션 🧀CHEEZE치즈 pH-1🧡의 일상생활 브이로그 | 반려일기 안무연습 플레이리스트 쿡방 | 딩고뮤직 | dingomusic,조회수 104703회,2.6천,15,2019. 9. 1.
77,ENG아이돌 데뷔 과정 전격 대공개 다이어트메이크업쇼케이스Revealing OH HAYOUNG’s Solo Debut Story,조회수 403572회,8.3천,81,2019. 8. 30.
78,김동준 - 못 헤어져서 미안해Sorry I Can't세로라이브SERO LIVE딩고뮤직dingomusic,조회수 280423회,5.6천,96,2019. 8. 28.
79,벤 BEN - 헤어져줘서 고마워Thank you for Goodbye세로라이브SERO LIVE딩고뮤직dingomusic,조회수 167567회,3.6천,74,2019. 8. 27.
80,맨손으로  뜯어내다가 멘붕 온 신인 여아이돌의 현실 반응 | 밥 잘 사주는 딩고 | 로켓펀치 편,조회수 143273회,4.7천,35,2019. 8. 27.
81,닐로Nilo - 벗 He'story세로라이브SERO LIVE딩고뮤직dingomusic,조회수 338107회,3.3천,285,2019. 8. 26.
82,역대급 멘붕쑈 펼치고 간 권현빈 VIINI 도깨비방망이 라이브 엉망진창 제작소 : LIVE,조회수 75550회,9.4천,37,2019. 8. 23.
83,신인걸그룹 촬영장에 귀신이 나타났다 | 음향사고 | 로켓펀치 Rocket Punch - 빔밤붐 BIM BAM BUM,조회수 277655회,1만,120,2019. 8. 21.
84,위너 소슴이 김진우가 딩고에 또또또  | 집터뷰ZIPTERVIEW | 진우 | WINNER | 딩고뮤직,조회수 68755회,6.4천,10,2019. 8. 19.
85,게임돌에게 요리를 시키면 안되는 이유 | 밥 잘 사주는 딩고 | 온앤오프 편,조회수 51543회,829,9,2019. 8. 16.
86,호우god 손호영&김태우 HoooW - 친구는 이제 끝내기로 해세로라이브SERO LIVE딩고뮤직dingomusic,조회수 27840회,1.1천,20,2019. 8. 16.
87,에이틴 걔 신곡 OST 냈대세잘지2 OST원래이래 - 소수빈Soo Bin SoLyric live videodingotunes,조회수 8644회,373,6,2019. 8. 16.
88,베드씬 있는 위너와 함께한 100초로 듣는 김진우 with WINNER | 신곡 ‘또또또’ 라이브 최초 공개 4K 딩고뮤직,조회수 233095회,3.5만,73,2019. 8. 14.
89,딩고가 본업 마치고 퇴근하는 뽀시래기 들튀함feat청량돌 | 온앤오프 |,조회수 11301회,503,4,2019. 8. 14.
90,청춘물 웹드에서 들어봤던 그 곡 세잘지2 OST원래 이래 - 소수빈Soo Bin SoLyric video teaserdingotunes,조회수 6493회,175,2,2019. 8. 13.
91,JBJ95 딩고 촬영장에 갑자기 사이렌이 울린 사연은 음향사고 JBJ95 - 불꽃처럼dingo music,조회수 45663회,3.8천,13,2019. 8. 12.
92,춤추다 음향사고 나서 단체로 멘탈 털려버린 오마이걸 | BUNGEE | ROLLER COASTER DANCEVER,조회수 520872회,1.2만,102,2019. 8. 9.
93,ENG SUB 팔로우 소미 FOLLOW SOMI 통합본 | 전소미SOMI의 먹방+여행+브이로그+리얼 라이프 | 리얼리티REALITY | dingo music,조회수 108612회,5천,49,2019. 7. 30.
94,ENG SUB대환장 파티 열고 간 저세상 ASMR 먹방 | 밥 잘 사주는 딩고_ 스트레이키즈 편 | Stray Kids | ASMR mukbang,조회수 507117회,5.2만,85,2019. 7. 27.
95,ENG SUB딩고한테 속아서 고깃집 알바하고 간 아이돌 | 스트레이키즈 편 | 밥잘사주는딩고 EP_1 | Stray Kids | 먹방 | mukbang,조회수 243027회,2.6만,72,2019. 7. 21.
96,ENG SUB 방송에 나온적 없는 JMT 맛집 뿌시고 옴feat스트레이키즈 | 밥 잘 사주는 딩고 예고 | 먹방 | mukbang | Stray Kids,조회수 75352회,1.1만,20,2019. 7. 19.
97,ENG SUB여자아이들의 비글파티에 당신을 초대합니다 슈화 메인랩퍼로 포지션 변경 수진 다리 길이 3미터 설  | 딩고뮤직 | 딩톡방 | GI-DLE,조회수 427182회,1.4만,76,2019. 7. 9.
98,ENG SUB AB6IX가 몰래 찾아온 손님 때문에 놀라 나자빠진 이유｜AB6IX 의리게임｜ep6,조회수 646078회,2.1만,389,2019. 7. 9.
99,ENG SUB 전소미가 티비보다가 운 사연은 소미의 못다한 이야기FOLLOW SOMI 마지막회 | FRIENDS | SOMI REALITY l dingo music,조회수 547598회,8.8천,628,최초 공개: 2019. 7. 8.
100,ENG SUB 여자친구 멤버들 촬영 중 너무 웃겨서 울어버렸다ㅋㅋ | 마피아댄스 | GFRIEND - FEVER | MAFIA DANCE,조회수 2179841회,6.1만,794,2019. 7. 8.
101,예고 Teaser 여자친구 GFRIEND - 마피아댄스 MAFIA DANCE,조회수 76251회,6.1천,20,2019. 7. 7.
102,RoomShaker_cover |  에일리 댄스 커버 챌린지 | Ailee | RoomShaker | cover dance challenge,조회수 37308회,1천,10,2019. 7. 4.
103,에일리 AILEE - Room Shaker | Performance video 8K | MOVE REC,조회수 595974회,3.7만,166,2019. 7. 2.
104,ENG SUB 소미가 딩고 촬영을 거부한 이유는소미의 나홀로여행 편 여행 브이로그 | FOLLOW SOMI | SOMI_TRAVEL | dingo music,조회수 852002회,1.6만,1천,최초 공개: 2019. 7. 1.
105,청하가 게다리 춤을 춘 사연은 / 음향사고 청하 CHUNG HA - Snapping / 4K,조회수 3614016회,13만,850,2019. 6. 30.
106,민수&서사무엘-티내볼게Prod RaDVisual LIVE film딩고뮤직dingotunes,조회수 45840회,882,105,2019. 6. 30.
107,이슬라이브  에일리 - 히트곡 메들리 Best Songs Of Ailee | 마 이게 무반주 라이브다 술집에서 콘서트하는 에일리 | Tipsy Live | 딩고뮤직,조회수 982029회,2.3만,160,2019. 6. 29.
108,teaser 민수&서사무엘-티내볼게Prod RaDVisual LIVE film딩고뮤직dingotunes,조회수 10355회,221,8,2019. 6. 29.
109,세로댄스 | SERO DANCE 일반인들의 아이돌 메들리 | 트와이스 블랙핑크 위너 ITZY 은하&라비 | K-POP IDOL CHOREOGRAPHY,조회수 58424회,914,30,2019. 6. 29.
110,ENG SUB게임하다가 손절할 것 같은 예능돌의 역대급 현웃 모먼트 |AB6IX 의리게임| ep5,조회수 1440801회,3.9만,807,2019. 6. 28.
111,4K 100초로 보는 여자아이들 GI-DLE | 🧚♀️신곡 Uh-Oh 무대 최초 공개  | 100sec Dingo music Choreography,조회수 2417424회,11만,1천,2019. 6. 26.
112,청하 CHUNG HA - Snapping | Performance video 5K | MOVE REC,조회수 1790598회,9.1만,484,2019. 6. 25.
113,ENG SUB 전소미가 10kg을 죽기 살기로 뺀 이유는 소미의 일상+먹방+브이로그 대방출 | FOLLOW SOMI | SOMI_DAILY | dingo music,조회수 1230449회,1.8만,969,2019. 6. 24.
114,ENG SUB 막장실화 그것이 알고 싶다/ 용의자 박씨의 행적 | AB6IX의리게임 | ep4,조회수 609657회,1.8만,382,2019. 6. 21.
115,장혜진 윤민수바이브 - 술이 문제야Drunk On Love세로라이브SERO LIVE딩고뮤직dingomusic,조회수 3785225회,3.8만,1천,2019. 6. 21.
116,예고 차트 1위 씹어먹고 있는 갓띵곡 세로라이브 온다♥ 술이 문제야장혜진윤민수딩고뮤직,조회수 28334회,315,5,2019. 6. 20.
117,ENG SUB 세븐틴 부승관 제주도에서 딩고때문에 어금니 꺅 깨문 사연은feat주먹울음빙고트립하딩고뮤직,조회수 212282회,1.5만,38,2019. 6. 20.
118,Hot Debut 온리원오브의 감성 충만 발라드 라이브｜세로라이브｜온리원오브 OnlyOneOf 타임리프 timeleap 아이돌 live,조회수 19212회,1.3천,7,2019. 6. 20.
119,ENG SUB  3년 만에 드디어 데뷔한 전소미 에게 무슨 일이 | FOLLOW SOMI | BIRTHDAY | dingo music,조회수 1256304회,좋아요,싫어요,최초 공개: 2019. 6. 17.
120,야경보며 듣기 좋은 어반자카파 신곡 | 세로라이브 | 어반자카파 - 서울 밤 feat 빈지노,조회수 188479회,2.4천,39,2019. 6. 15.
121,ENG SUB여자교복 입고 비주얼 만렙찍은 키183 교복남의 하루 | AB6IX의리게임 | ep3,조회수 657768회,1.7만,581,2019. 6. 14.
122,ENG SUB ★전소미 첫 단독 리얼리티★ 소미의 먹방+쿡방+댄스+브이로그 대방출FOLLOW SOMI 팔로우 소미 | teaser 1 | BIRTHDAY,조회수 248337회,1.1만,139,2019. 6. 13.
123,ENG SUB 세븐틴 부승관 고향 제주도에서 우당탕탕 하루를 보낸 여행기 빙고트립상딩고뮤직,조회수 349984회,2.5만,53,2019. 6. 13.
124,단독공개 AB6IX 임영민이 교복 치마 입고 사진 남기게 된 사연feat임또졌,조회수 47466회,2.7천,9,2019. 6. 13.
125,TEEN TOP 틴탑 - Run Away | Performance video 4K | MOVE REC,조회수 23269회,1.8천,12,2019. 6. 12.
126,세븐틴SVT 전원 걸고 딩고에게 선서한 승관 대체 무슨일이,조회수 23918회,2.5천,6,2019. 6. 11.
127,전지적 연인 시점 LIVE 존예 신인가수가 나한테 와서 신곡을 불러준다면 한강 찢어벌인 역대급 설렘 ❤️일대일 라이브 | 딩고뮤직 보라미유 DINGO MUSIC,조회수 22140회,678,6,2019. 6. 11.
128,민수가 드디어 세로라이브에 ✨ '민수 - I Like Me’ | 세로라이브 SERO LIVE | Minsu,조회수 173276회,2.4천,52,2019. 6. 7.
129,도른자 모먼트 보이는 흔한 신인아이돌의 예능감feat섹베오레 박우진  | AB6IX 의리게임 | ep2,조회수 867447회,2.4만,477,2019. 6. 7.
130,100초로 듣는 이하이 | leehi | 딩고뮤직 | Dingo Music | 100sec LIVE | 한숨 | Rose | 1234 | 누구없소,조회수 794496회,4.5만,257,2019. 6. 6.
131,만 원 들고 편의점 털러가 멘탈 털린 아이돌 | AB6IX 의리게임 | ep2 예고,조회수 72562회,4.3천,22,2019. 6. 6.
132,신인가수가 보라미유가 노래방에서 소리지른 사연은무반주라이브보라미유안녕 뜨거웠던 우리Boramiyu딩고뮤직dingomusic,조회수 22051회,675,8,2019. 6. 5.
133,세로라이브 | 이하이&비아이 : 똑똑✊누구 없소 | 이하이 - 누구 없소 feat BI of iKON,조회수 2782987회,19만,915,2019. 6. 3.
134,ENG SUB 딩고 첫 출연에 비밀 폭로하고 간 아이돌 | AB6IX | 의리게임 Ep1 |  에이비식스 | 딩고뮤직 | dingo,조회수 1303248회,3.5만,1천,2019. 5. 31.
135,알라딘 자스민 공주 빙의한 러블리즈 - 그 시절 우리가 사랑했던 우리 Lovelyz - Beautiful Days Performance video 4K MOVE REC 딩고,조회수 214166회,6.4천,64,2019. 5. 31.
136,CLC - ME美 | Performance video 5K | MOVE REC,조회수 926643회,5.6만,264,2019. 5. 29.
137,음색여신 보라미유 앨범 나옴보라미유안녕 뜨거웠던 우리Beautiful break up songsBoramiyu딩고뮤직dingomusic,조회수 128365회,3.8천,40,2019. 5. 28.
138,아름다운 이별 노래 BEST5보라미유Beautiful break up songsBoramiyu딩고뮤직dingomusic,조회수 57430회,2.7천,8,2019. 5. 26.
139,AB6IX - BREATHE | Performance video | MOVE REC | Dingo Music | 4K,조회수 338554회,3.2만,66,2019. 5. 25.
140,AB6IX x 딩고 착한 얼굴에 그렇지 못한 승부욕 자랑하는 예삐들 과연 생존 경쟁의 1위는 누구 ft 임또졌,조회수 169979회,1.1만,21,2019. 5. 24.
141,예고 대휘 피셜 보면 큰 일 나는 AB6IX 영상의 정체는,조회수 31879회,2.4천,5,2019. 5. 24.
142,개드립이 난무하는 저 세상 텐션 김희철 때문에 멘탈 탈탈 털린 ★조정뱅이 규현★ 소집해제 기념 회식라이브 애월리Aewol-ri | Tipsy Live | 딩고뮤직,조회수 551327회,1.8만,98,2019. 5. 22.
143,펩시댄스챌린지 우승자 발표 설참,조회수 15814회,667,9,2019. 5. 20.
144,AB6IX 퍼지면 안되는 사진이 퍼져버렸다⁉️ 딩고PD들 손발이 줄줄 눈물이 벌벌난 사연은 1시간만에 리트윗 2000개 넘어벌인 그 사진의 정체 공개,조회수 47109회,2.9천,7,2019. 5. 17.
145,딩고X펩시 전국민 커플댄스 챌린지 당신이 뽑은 커플댄스 원픽은 누구⁉️,조회수 10876회,308,9,2019. 5. 17.
146,THE BOYZ 꽃밭에 모인 더보이즈 돌아버린 촬영장 | 딩고뮤직 | 비하인드 | 딩톡방,조회수 73478회,5.9천,15,2019. 5. 16.
147,이슬라이브 헨리 Henry - 제목없는 Love Song Untitled Love Song  | Tipsy Live | 딩고뮤직,조회수 117830회,4.2천,20,2019. 5. 9.
148,엄청나게 짱 멋있고 좋은 '에릭남 - Runaway' | 세로라이브 SERO LIVE | Eric Nam,조회수 101148회,8.4천,17,2019. 5. 8.
149,WINNER 위너 강승윤 김진우가 울음 참아가며 인순이와 함께 수어수화로 부른 ‘아버지’ 마음으로 보는 라이브/4K/거울 모드 sign language Live 딩고뮤직,조회수 289081회,1.5만,61,2019. 5. 7.
150,회식라이브 얼굴 터지기 일보 직전인 ㄹㅇ 술톤 조남지대조세호 남창희X유병재 - 거기 지금 어디야 | Tipsy Live | 딩고뮤직,조회수 64662회,598,33,2019. 5. 5.
151,이별 후 남자의 갬성 가-득 품고 있는 조남지대 - 거기 지금 어디야 Lyrics video조세호 남창희리릭비디오 l LIVE딩고뮤직 Dingomusic,조회수 55132회,781,21,2019. 5. 4.
152,THE BOYZ 더보이즈 - Bloom Bloom | Performance video 4K | MOVE REC,조회수 251705회,2.3만,28,2019. 5. 3.
153,실제 이별썰로 음원내고 가수 데뷔한 조남지대 신촌 버스킹 현장 l 조세호 남창희Live l 딩고뮤직 Dingomusic,조회수 19421회,290,5,2019. 5. 3.
154,예고 THE BOYZ 더보이즈가 딩고 꽃밭에 피었습니다,조회수 6518회,675,4,2019. 5. 2.
155,딩고스쿨 얼죽아 vs 쪄죽따 스키즈 팀워크 박살날 뻔한 끝장토론  Dingo School - 스트레이 키즈 StrayKids EP03 딩고뮤직 Dingo Music,조회수 878374회,5.6만,119,2019. 4. 29.
156,띠용주의 형이 거기서 왜 나와 조세호 남창희 갬성 이정도 '거기 지금 어디야' l 조세호 남창희Live l 딩고뮤직 Dingomusic,조회수 370643회,4.3천,123,2019. 4. 28.
