,title,view,like,unlike,date
157,조세호와 남창희에게 눈물 연기를 시켜보았다성공실패,조회수 7283회,150,22,2019. 4. 26.
158,딩고스쿨 애교라고 쓰고 저세상 개그를 하는 아이돌이 있다  DingoSchool - 스트레이 키즈 Stray Kids EP 02 딩고뮤직 DingoMusic,조회수 1102682회,6.3만,163,2019. 4. 26.
159,축가 버스킹 이젠 음원까지 이별갬성 오지는 조세호&남창희의 거기 지금 어디야 티져영상,조회수 12543회,178,9,2019. 4. 25.
160,이슬라이브 정승환 - 우주선 Jung Seung Hwan - The Voyager | Tipsy Live | 딩고뮤직,조회수 79202회,1.9천,13,2019. 4. 24.
161,딩고스쿨 19세 막내 형들 어깨넘어 배운 섹시 대방출 근데 형들 반응 무엇 Dingo School - 스트레이키즈 StrayKids  EP01 딩고뮤직 Dingo,조회수 2305289회,12만,384,2019. 4. 22.
162,딩고X펩시 펩시 댄스 챌린지 OPEN 펩시들고 춤추기만 하면 엄청난 상품이,조회수 25719회,1.5천,11,2019. 4. 22.
163,4K 요즘 중독성 쩐다고 입소문 타는 그 노래  밴디트 BVNDIT l 호커스포커스 HocusPocus l 뷰티캠 Beauty Cam  Live l 딩고뮤직 Dingo,조회수 100347회,1.5천,182,2019. 4. 19.
164,귀염뽀짝 스키즈랑 같은 반되면 이런 기분 팬들 주접댓글 읽고 부끄러운 남돌 모습jyp l 스트레이키즈 Stray Kids l 딩고스쿨 Dingo School,조회수 35366회,4.3천,2,2019. 4. 19.
165,존잘주의 여기가 바로 얼굴맛집  스키즈의 팬들의 미모찬양 댓글읽기 스트레이키즈 Stray Kids l 딩고스쿨 Dingo School,조회수 44421회,6천,8,2019. 4. 17.
166,ENG SUB 마마무 비투비가 롤모델이라는 BVNDIT 밴디트의 귀염뽀짝 Hocus Pocus 호커스포커스 라이브 I dingomusic I 밴라이브,조회수 49482회,1천,41,2019. 4. 16.
167,데이식스 멤버들이 다같이 정줄 놓고 아무말 대파티 하는 현장 포착｜B컷하드털이｜DAY6 behind cut,조회수 25775회,2.1천,8,2019. 4. 16.
168,100초로 보는 그루트 아니 카더가든 | 딩고뮤직 | Dingo Music | 100sec LIVE,조회수 92713회,3.3천,12,2019. 4. 15.
169,개그아님 팬들의 주접댓글을 읽은 아이돌의 현실반응   딩고스쿨 Dingo School  Teaser  스트레이 키즈 Stray Kids,조회수 83102회,1만,12,2019. 4. 15.
170,K-POP Rookie​BVNDIT밴디트 - Hocus PocusPerformanceMOVE REC 4K,조회수 131390회,1.8천,58,2019. 4. 11.
171,ENG SUB 데뷔조 멤버들 폭풍오열하게 한 엄마의 영상편지avi | 밴디트 | BVNDIT | HOCUS POCUS | 연습생 | 감동 | 내일을 응원해,조회수 102687회,2.9천,51,2019. 4. 9.
172,이슬라이브 첸 CHEN - 사월이 지나면 우리 헤어져요 Beautiful goodbye with 임한별 Onestar | Tipsy Live,조회수 636812회,5.6만,91,2019. 4. 9.
173,세로라이브 길구봉구 GB9 - 있어줄래 Stay Here LIVE,조회수 188827회,2.3천,36,2019. 4. 8.
174,여자아이들 수진이 요가 교실에서 웃음을 참을 수 없었던 이유는｜B컷하드털이｜GI-DLE SOOJIN Yoga class,조회수 27322회,909,8,2019. 4. 5.
175,엉망진창 제작소 볼빨간 사춘기bol4 - 나만 봄Bom,조회수 409735회,1.4만,81,2019. 4. 5.
176,의상 체인지 하는게 어려워서 파닥거리는 귀여운 아기맠ㅠㅠㅠ｜B컷하드털이｜엔씨티 NCT 마크 Mark NG영상,조회수 30080회,2천,6,2019. 4. 4.
177,세로라이브 최초로 1테이크만에 끝난 HYNN박혜원 - 시든 꽃에 물을 주듯,조회수 2864997회,3.9만,484,2019. 4. 4.
178,스트레이키즈가 딩고에게 애교 잔뜩 담긴 영상을 보낸 이유는｜B컷하드털이｜Straykids 현진 Hyunjin 한 HAN NG영상,조회수 29727회,4.3천,5,2019. 4. 3.
179,BTS l 블랙핑크 BLACKPINK트와이스 Twice l EXO 케이팝 데뷔곡 갑은 Kpop best debut song cover l 댄스 Dance 밴디트 BVNDIT,조회수 141533회,6.2천,100,2019. 4. 3.
180,5초만에 딩고를 다 뒤집어놓은 크러쉬의 이행시｜B컷하드털이｜Crush 비하인드 behind,조회수 22228회,309,15,2019. 4. 2.
181,첸 CHEN of EXO - 사월이 지나면 우리 헤어져요 세로라이브 LIVE,조회수 1054576회,9.9만,229,2019. 4. 2.
182,정세운이 자신있게 선보인 피아노 연주곡은｜B컷하드털이｜JUNGSEWOON piano behind,조회수 13081회,839,4,2019. 4. 1.
183,예고 첸이 4월과 함께 세로라이브에 찾아 왔어요 | EXO CHEN - Teaser,조회수 47888회,1.1만,10,2019. 3. 31.
184,CHEN 100sec 4K 100초 100초로 듣는 첸,조회수 761842회,12만,146,2019. 3. 30.
185,자칭타칭 셀카 장인 김동한 어느 각도에서나 잘 생겨서 논란｜B컷하드털이｜KIMDONGHAN selfie behind,조회수 9727회,587,10,2019. 3. 29.
186,Ruel - Not Thinkin' Bout You FeatSam Kim 세로라이브 LIVE,조회수 546317회,4.9만,95,2019. 3. 29.
187,Caution Korean Sword Dance 근엄주의신인돌 밴디트 시명 한국무용 퍼포먼스 | BVNDIT l 딩고뮤직신소개 | 검무,조회수 46351회,2.1천,19,2019. 3. 29.
188,예고 ⭐️첸이 딩고에 왔어요⭐️ | EXO CHEN - Teaser,조회수 92070회,2.3만,22,2019. 3. 28.
189,세븐틴 부승관이 녹화 뒷정리 하면서 부른 '이 소설의 끝을 다시 써보려 해' 라이브｜B컷하드털이｜SEVENTEEN LIVE,조회수 40764회,2.7천,7,2019. 3. 28.
190,스트레이키즈Stray Kids의 대환장파티 열린 MIROH 미로 라이브 엉망진창 제작소 : LIVE_full버전,조회수 1316899회,12만,195,2019. 3. 27.
191,오마이걸 효정이 차 안에서 즉석으로 불러준 '거짓말도 보여요' 라이브｜B컷하드털이｜OHMYGIRL LIVE,조회수 13471회,579,2,2019. 3. 27.
192,펜타곤PENTAGON이 꽹과리 탭핑하면서 부른 신토불이 몰빵 라이브 | Jackpot Live | 딩고뮤직 | dingo,조회수 171876회,1.5만,30,2019. 3. 27.
193,100초로 듣는 수란 SURAN100초딩고뮤직100Sec LIVE그놈의별1+1=0러브스토리전화끊지마오늘취하면,조회수 150850회,8.4천,55,2019. 3. 27.
194,데이식스가 촬영 도중 무반주로 불러준 '그렇더라고요' 라이브｜B컷하드털이｜DAY6 LIVE｜Jae 성진 Young K 원필 도운,조회수 25792회,2.5천,4,2019. 3. 26.
195,BVNDIT 밴디트 승은 | BTS | EXO | WANNAONE | 4분 만에 보는 K-POP 댄스 모음 | BVNDIT | DANCE COVER | Choreography,조회수 180168회,8.1천,209,2019. 3. 26.
196,스트레이키즈 형아들이 막내 아이엔의 덕후가 될 수 밖에 없는 치명적인 이유｜B컷하드털이｜Stray Kids 우진 방찬 리노 창빈 현진 한 필릭스 승민 IN,조회수 38344회,3.4천,2,2019. 3. 25.
197,세상 청아함 다 끌어모은 우기의 고쟁 연주｜B컷하드털이｜여자아이들 I-DLE 우기 YUQI,조회수 25854회,1.4천,3,2019. 3. 24.
198,ENG SUB 신인 걸그룹 BVNDIT에 대해 알고 싶다면 | Chat Interview 청하&밴디트 편 | CHUNG HA | 읽씹금지 | 딩고뮤직,조회수 93117회,2.7천,16,2019. 3. 23.
199,딩고가 입덕해버릴 수 밖에 없었던 아이돌 실물 영접 후기｜B컷하드털이｜Straykids 스트레이키즈 우진 방찬 리노 창빈 현진 한 필릭스 승민 IN,조회수 81650회,7.9천,19,2019. 3. 23.
200,카메라 꺼진 이달의 소녀LOONA 촬영장 실황은 ▶️저 세상 텐션 주의 딩고뮤직 B컷딩톡방,조회수 66950회,4.1천,18,2019. 3. 22.
201,제노가 눈웃음으로 여럿 쓰러지게 한 바로 '그 짤' ｜B컷하드털이｜NCT JENO 100초 비하인드 Behind,조회수 46435회,4.5천,11,2019. 3. 22.
202,100초로 듣는 거미 GUMMY100초딩고뮤직100Sec LIVE,조회수 395852회,1만,30,2019. 3. 21.
203,몰빵라이브 모모랜드MOMOLAND - I’m So Hot암쏘핫 Jackpot Live4K,조회수 275425회,1만,376,2019. 3. 21.
204,거미 Gummy - 혼자 ALONE 세로라이브 LIVE,조회수 477678회,4.9천,125,2019. 3. 18.
205,잔나비 JANNABI 100초로 듣는 잔나비 명곡 모음,조회수 2878617회,6.7만,796,2019. 3. 15.
206,ENG SUB 에픽하이X크러쉬가 함께한 ‘술이 달다’에 술이 빠질 수 없잖아 | Epik High - LOVEDRUNK | 회식라이브 | 딩고뮤직,조회수 371955회,1만,64,최초 공개: 2019. 3. 12.
207,우석X관린 - 별짓 라이브 역대급 케미도 터지고 광대도 터졌다 | 세로라이브 | I'M A STAR | WOOSEOKXKUANLIN LIVE,조회수 686623회,5.9만,150,2019. 3. 11.
208,몰빵라이브 이달의 소녀LOONA - Butterfly Jackpot Live4K,조회수 115311회,7.9천,57,2019. 3. 9.
209,갓떼리언니 행사 현장 고대로 모셔온 '100초로 보는 홍진영',조회수 162956회,4.7천,33,최초 공개: 2019. 3. 8.
210,⏱100초로 보는 홍진영 예고⏱,조회수 10736회,188,4,2019. 3. 6.
211,차트 1위 십센치10cm '그러나' 부터 ‘스토커’까지 띵곡파티 100초  권정열  100초로 듣는 10cm  딩고뮤직  100sec LIVE,조회수 489692회,1.4만,65,2019. 3. 6.
212,여자아이들이 우기 때문에 인내심이 대폭발해버렸다 | 마피아댄스 | MAFIA DANCE | Senorita | GI-DLE,조회수 2949794회,7.8만,601,2019. 3. 6.
213,래퍼가 노래까지 잘해 라비 RAVI  - TUXEDO 라이브  딩고뮤직  세로라이브,조회수 96706회,9.5천,25,2019. 3. 6.
214,몰빵라이브 에이티즈ATEEZ - HALAHALA,조회수 977491회,8.5만,136,2019. 3. 5.
215,ENG SUB술 냄새 풀풀 나는 인피니트 동우의 회식라이브 | INFINITE JangDongWoo - News,조회수 180050회,1.1만,42,2019. 3. 5.
216,여자아이들 GI-DLE Senorita Performance video | MOVE REC | 4K,조회수 334250회,1.7만,119,2019. 3. 2.
217,누명전문배우 찬희 진짜 누명을 쓰게 됐다 | SF9 에스에프나인 - 마피아댄스 MAFIA DANCE,조회수 1203644회,4만,170,2019. 3. 1.
218,세로라이브 뮤지 Muzie with윤상 밀린일기 | 딩고뮤직 SERO Live,조회수 61262회,1.4천,14,2019. 3. 1.
219,100초로 듣는 주니엘 JUNIEL100초딩고뮤직100Sec LIVE,조회수 238698회,7.8천,37,2019. 2. 28.
220,강민경 Kang min kyung - 사랑해서 그래Because I love you LIVE 세로라이브,조회수 359859회,5.6천,69,2019. 2. 27.
221,세로라이브 골든차일드 주찬 - 문제아 Golden Child Joo Chan 'A Song for Me' | 딩고뮤직,조회수 46616회,4.4천,8,2019. 2. 27.
222,몰빵 라이브 SF9 - 예뻐지지 마 SF9 - Enough Jackpot Live 4K,조회수 399559회,2.4만,53,2019. 2. 26.
223,김보형 세로라이브 훨훨 l SERO l Live 딩고뮤직,조회수 22143회,795,5,2019. 2. 22.
224,SF9 - 예뻐지지 마 Enough | Performance video | MOVE REC,조회수 302205회,2.1만,33,2019. 2. 21.
225,워너원 첫 솔로로 아련미 뒤집어 쓴 윤지성 세로라이브  in the Rain l SERO l Live 딩고뮤직,조회수 188358회,1.6만,557,2019. 2. 20.
226,인피니트INFINITE - CLOCK 몰빵라이브 Jackpot Live,조회수 344080회,2.4만,45,2019. 2. 20.
227,몰빵라이브 예고 인피니트INFINITE_CLOCK,조회수 20239회,2천,8,2019. 2. 19.
228,4K 음원차트 1위 씹어먹고 있는 퀸화사화사Hwa Sa'멍청이twit' 역대급 세로 댄스,조회수 1349819회,6.5만,493,2019. 2. 19.
229,100초로 듣는 박혜경100초딩고뮤직100Sec LIVE,조회수 37765회,1천,10,2019. 2. 16.
230,4K 100초로 듣는 인피니트 INFINITE | 신곡 CLOCK 공개 | Dingo 100sec LIVE 딩고뮤직,조회수 686884회,4.4만,112,2019. 2. 15.
231,어느 남돌이 노래하다 멜론 깬 이유는 에이티즈 ATEEZ - Fantastic baby |  딩고노래자랑,조회수 416268회,4만,46,2019. 2. 15.
232,세븐틴 정한이 수상한 돌잔치 찍다가 갑자기 현타 맞은 이유는｜수상한 돌잔치 Behind cut｜SEVENTEEN Jeonghan,조회수 44412회,3.9천,10,2019. 2. 14.
233,스무살 20 Years of Age - 왜 그때는 Hindsight 20/20 세로라이브 LIVE,조회수 18214회,364,12,2019. 2. 11.
234,ATEEZ 에이티즈 - HALA HALA Performance video | 4K | MOVE REC,조회수 716294회,6.3만,94,2019. 2. 9.
235,폴킴과 민서의 달달 터지는 라이브 | 세로라이브 SERO LIVE | 민서 2cmfeat폴킴 MINSEO PAULKIM,조회수 173519회,4.5천,43,2019. 2. 1.
236,미래일기 ep_16 몬스타엑스가 역대급 목청으로 싸운 사연은,조회수 53842회,2.2천,3,2019. 1. 30.
237,★가왕 '독수리건' 이현★ 방시혁이 쓴 신곡 '아직은'까지 한번에 100초로 듣는 이현,조회수 33543회,1.4천,3,2019. 1. 28.
238,미래일기 ep_15 몬스타엑스가 길에서 갑자기 매를 맞은 사연은,조회수 46142회,2천,10,2019. 1. 25.
239,널끊겠어↗️ 어↗️ 어↗️ 어↗️  역대급 라이브 부승관 - 와이파이 켜짐 귀에 맴도는 중독성 치사량 주의⚠⚠ 원곡 : 윤종신 | 세로라이브 SERO LIVE,조회수 2238659회,9.7만,440,2019. 1. 25.
240,임한별이 노래방에서 무반주로 라이브를 무반주라이브임한별 - 사랑 이딴 거,조회수 171903회,2.2천,21,2019. 1. 23.
241,세븐틴이 역대급 애교짤을 생성한 이유는 미래일기_ep 14,조회수 108937회,5.6천,16,2019. 1. 23.
242,세로라이브 니엘 with 김형석 - 너의 뒤에서,조회수 28999회,1.1천,10,2019. 1. 22.
243,세로라이브 예고 너의 뒤에서_니엘TEENTOP with 김형석,조회수 6953회,276,5,2019. 1. 21.
244,세븐틴이 의문의 탈것 때문에 고통받은 사연은 미래일기_ep 13,조회수 161373회,8천,26,2019. 1. 18.
245,여치니들이 셀프 뮤비 만드는데 대환장파티닼ㅋㅋㅋㅋ | 뮤비는 셀프-여자친구GFRIEND,조회수 480949회,1.9만,117,2019. 1. 18.
246,미래일기 ep_12 뉴이스트W 민기가 종현이때문에 공중에 대롱대롱 매달리게 된 사연은,조회수 33014회,1.7천,6,2019. 1. 16.
247,★최초공개★ 여자친구 신곡 해야 안무 영상 GFRIEND - Sunrise | Performance video 4K | MOVE REC,조회수 1252826회,4.9만,586,2019. 1. 14.
248,반전 락스피릿 자아 이창섭 'Shelter' 들을수록 딩고뮤직수록곡라이브,조회수 165534회,1만,20,2019. 1. 13.
249,미래일기 ep_11 뉴이스트W 종현이가 민기때문에 길에서 무반주댄스를 추게 된 사연은,조회수 44276회,2.4천,4,2019. 1. 11.
250,딩고PD 허파 찢은 젭꿍이들 웃음폭발 촬영 비하인드 JBJ95딩고뮤직딩톡방,조회수 29957회,1.6천,8,2019. 1. 11.
251,미래일기_ep10 B1A4 멤버들이 수상한 차림으로 시장에 나타난 이유는,조회수 20074회,946,7,2019. 1. 9.
252,김민석 댕댕미 폭발하는 ’선물’ 같은 라이브 Good Night - Kim MinSeok Acoustic ver | 언플러그드프로젝트,조회수 24674회,1천,8,2019. 1. 7.
253,스텔라장 Stella Jang - 월요병가 인디플레이 LIVE,조회수 119093회,2.7천,21,2019. 1. 6.
254,미래일기_ep09 B1A4 멤버들이 멱살잡고 주먹다짐 한 이유는,조회수 35286회,1.5천,7,2019. 1. 4.
255,딩고와의 배틀의 신으로 거듭난 DAY6 데이식스딩고뮤직비하인드딩톡방,조회수 271178회,1.4만,20,2019. 1. 4.
256,귀욤뽀짝 젭꿍이들 반전 매력 댄스 JBJ95 - Home | @STAGE,조회수 14622회,1.4천,4,2019. 1. 4.
257,홍진영 HONG JIN YOUNG - 사랑은 다 이러니 Love is 세로라이브 LIVE,조회수 477533회,6천,117,2019. 1. 4.
258,2019 황금돼지의 해 ♀️스타들의 새해인사 | 딩고뮤직 LIVE,조회수 21425회,721,16,2019. 1. 2.
259,청하는 못하는게 뭐야 청하표 발라드 '너의 온도' 들을수록CHUNG HA | 딩고뮤직dingo music | 라이브수록곡,조회수 106541회,4.7천,27,2019. 1. 2.
260,미래일기_ep 08 에이핑크가 길거리에서 주먹을 휘두른 사연은 남주&하영 2편,조회수 65715회,1.6천,24,2019. 1. 2.
261,100초로 보는 청하 CHUNG HA I 100 sec Choreography I 딩고 4K 고화질 / 100초,조회수 1351083회,5.7만,221,2019. 1. 2.
262,옥상달빛 OKDAL- 수고했어 오늘도 인디플레이 LIVE 라이브,조회수 126992회,3천,31,2018. 12. 31.
263,이슬라이브 김준수 XIA - 사랑은 눈꽃처럼 | How Can I Love You,조회수 70433회,3.6천,41,2018. 12. 31.
264,미래일기_ep 07 에이핑크 때문에 스탭들이 갑자기 정색한 이유는 남주&하영 1편,조회수 87862회,1.6천,23,2018. 12. 28.
265,☃️데식이들과 함께 하는 이 아름다운 느낌♥ 'Beautiful Feeling' 라이브 | 데이식스 DAY6 | 4K | 들을수록 |,조회수 241183회,2.2만,29,2018. 12. 28.
266,딩고 어워즈2018년 딩고뮤직을 빛낸 최고의 콘텐츠는 무엇 당장 들어와서 내새꾸 있는지 확인할 것🥰 | 딩고뮤직 라이브 댄스 예능,조회수 56170회,1천,37,2018. 12. 27.
267,🦁용덕별덕휜덕혲덕 여기다모엿 마마무 MAMAMOO '생각보단 괜찮아' 라이브 | 들을수록,조회수 125009회,1만,21,2018. 12. 27.
268,미래일기_ep06 스트레이키즈 멤버들이 남산에서 펑펑 눈물쏟은 사연은,조회수 80123회,4.7천,30,2018. 12. 26.
269,효린의 캐럴 최초 공개 크리스마스 데이 Christmas Day,조회수 23028회,1천,26,2018. 12. 25.
270,국민 남편 아닌 이효리 남편 이상순 읽씹금지 채팅 인터뷰 Chat Interview 타자소리 키보드 타이핑 ASMR,조회수 213707회,3.4천,144,2018. 12. 24.
271,몬스타엑스가 지옥행 열차에 탑승한 이유는｜미래일기 티저｜MONSTAX 예능 리얼리티,조회수 14625회,1천,3,2018. 12. 24.
272,김시몬스가 달달한 목소리로 딩고를 애타게 찾은 이유는｜언플러그드 프로젝트 티저｜김민석 라이브 live,조회수 7954회,196,4,2018. 12. 23.
273,핫한 아티스트 위켄드를 보고 훈남들이 놀란 이유는/ 콘서트리뷰 The Weeknd,조회수 8435회,217,6,2018. 12. 22.
274,미래일기_ep05 스트레이키즈 멤버들이 초딩들에게 놀림받은 사연은,조회수 104654회,5.2천,31,2018. 12. 21.
275,똑똑 젭꿍이들 딩고 왔어요 ｜@STAGE 티저｜JBJ95 켄타 김상균,조회수 6887회,482,4,2018. 12. 20.
276,미래일기_ep04 여자친구 예린이가 106층 건물에서 번지점프를 하게 된 이유는 Feat위키미키 유정,조회수 356325회,5.7천,99,2018. 12. 19.
277,믿고 듣는 발라더 이석훈의 너였구나  | 세로라이브 SERO LIVE,조회수 120152회,1천,11,2018. 12. 19.
278,인생 최대 리액션 보여준 김민석 Good Night 라이브 엉망진창 제작소 : LIVE,조회수 57722회,1.9천,12,2018. 12. 18.
279,비투비 창섭이 역대급으로 멋지게 예고를 남기고 갔다고｜들을수록 창섭 예고｜BTOB 이창섭 라이브 live,조회수 25773회,2.3천,9,2018. 12. 17.
280,잔나비 JANNABI - 사랑하긴 했었나요 스쳐가는 인연이었나요 짧지않은 우리 함께했던 시간들이 자꾸 내 마음을 가둬두네 인디플레이 LIVE 라이브,조회수 475500회,8.4천,74,2018. 12. 17.
281,세븐틴 에스쿱스와 원우의 멘탈이 바사삭 부서진 이유는｜미래일기 세븐틴 편 티저｜seventeen,조회수 40006회,3.4천,7,최초 공개: 2018. 12. 17.
282,맑고 고운 청하가 딩고에 찾아온 이유는｜들을수록 청하 티저｜Chung Ha 라이브 live,조회수 14729회,479,3,2018. 12. 17.
283,미래일기_ep03 위키미키 유정이가 오랑우탄한테 침맞은 이유는 Feat여자친구 예린,조회수 133079회,2.4천,46,2018. 12. 14.
284,100초 100초로 듣는 윤하 YOUNHA LIVE,조회수 337705회,1만,50,2018. 12. 14.
285,딩고와 데이식스 조합은 늘 옳다 이번엔 또 무엇을 찍었을까요｜들을수록 데이식스 티저｜DAY6 라이브 LIVE,조회수 15675회,1.2천,6,2018. 12. 12.
286,이슬라이브 벤BEN - 180도 | 소주 마시면서 부르는 '180도' 술 취한 모습은 덤 | Tipsy Live | 이슬라이브,조회수 269355회,2.8천,68,2018. 12. 12.
287,미래일기_ep02GOT7 뱀뱀 유겸이 서로에게 욕을 하게 된 사연은,조회수 49098회,2.5천,9,2018. 12. 12.
288,비글미 넘치는 마마무 딩고에 놀러와서 뭐 하고 갔게｜들을수록 티저｜MAMAMOO 문별 솔라 휘인 화사,조회수 15619회,995,3,최초 공개: 2018. 12. 12.
289,존멋뿜뿜 백발로 변신 역대급 솔로곡 열창한 이창섭의 Gone | 세로라이브 SERO LIVE,조회수 507170회,2.7만,82,2018. 12. 11.
290,들을수록 아연이가 아연했다 반박불가 공주님 음색 백아연 띵곡 Starlight  딩고뮤직  라이브  수록곡,조회수 40175회,1천,49,2018. 12. 10.
291,크리스마스 분위기 뿜뿜 스웨덴세탁소 feat 바닐라어쿠스틱 - Snowball 세로라이브 LIVE Sweden Laundry Feat Vanilla acoustic,조회수 34034회,423,6,2018. 12. 10.
292,데이식스 DAY6 - 행복했던 날들이었다 | BGM | 4K LIVE,조회수 258314회,2.4만,22,2018. 12. 10.
293,뉴이스트W 동갑내기 별주부즈가 서로를 저격한 사연은｜미래일기 뉴이스트W 편 티저,조회수 8915회,573,3,최초 공개: 2018. 12. 10.
294,미래일기_ep01GOT7에게 미래를 바꾸는 일기장을 건네보았다,조회수 90200회,5.4천,19,2018. 12. 7.
295,빅스 라비가 선물한 그 곡구구단 - Do it 라이브들을수록,조회수 132213회,6.6천,42,2018. 12. 7.
296,이게 라이브라고 음색깡패 마마무의 Wind flower 라이브세로라이브,조회수 1048208회,5만,252,2018. 12. 4.
297,B1A4 산들 공찬이 신촌 길 한복판에서 인싸가 된 사연은,조회수 9510회,503,3,2018. 12. 3.
298,영혼 탈탈 털리고 케미 터지는 하상욱 x 권정열10cm - 다 정한 이별 엉망진창 제작소,조회수 127213회,2.6천,27,2018. 12. 1.
299,나비 NAVI - 빈 집 Empty House 세로라이브LIVE,조회수 32560회,583,3,2018. 12. 1.
300,K-pop 24/7 Live Stream | 여자 가수 특집 플레이리스트 Female Artist Playlist | Dingo OnAir | Dingo Music 딩고뮤직,조회수 14487회,367,7,실시간 스트리밍 시작일: 2018. 11. 30.
301,이슬라이브 윤종신 - 좋니 | 1년 만에 '좋니' 다시 부른 윤종신 좋니 위에 이슬을 뿌렸더니 대박각 | Tipsy Live,조회수 99429회,1.4천,26,2018. 11. 30.
302,역대급 소름돋는 어반자카파의 세로라이브Sero Live  어반자카파 - 이 밤이 특별해진 건  URBAN ZAKAPA - You're The Reason,조회수 90147회,1.6천,17,2018. 11. 30.
303,10cm 권정열 이별얘기에 눈물 난다ㅠ | 권정열X하상욱과 함께하는 이별택시 특별편,조회수 720703회,1만,95,2018. 11. 29.
304,100초 100초로 듣는 벤 BEN,조회수 452574회,9.9천,64,2018. 11. 29.
305,100초 100초로 듣는 선우정아,조회수 103699회,5.3천,24,2018. 11. 28.
306,에이핑크 남주와 하영이 평화 협정을 깨버린 이유는 역대급 웃음 핵폭탄 예고잼｜미래일기 에이핑크 편 티저,조회수 10665회,388,4,2018. 11. 26.
307,어반자카파 URBAN ZAKAPA - Beautiful Day 세아노 결혼식 축가 라이브 LIVE,조회수 119507회,1천,24,2018. 11. 24.
308,노래방 라이브 코노에 본인 노래 없어서 무반주로 부른 '권정열10cmX하상욱 - 다 정한 이별',조회수 305479회,6.4천,47,2018. 11. 23.
309,K-pop Playlist 남자 가수 특집 Male Artist Special | 2 hours Mix 2시간 연속 재생 | 24/7 Live Stream,조회수 15751회,453,7,실시간 스트리밍 시작일: 2018. 11. 23.
310,인소 남주st 할랕 ‘잘 지내줘’ 어쿠스틱 라이브 미모+감성 완벽크 | 하이라이트 Highlight | 언플러그드 프로젝트 | Unplugged Project,조회수 104130회,9.9천,8,2018. 11. 23.
311,짠내주의 이별한 나에게 이별요정이 찾아왔다 백아연 - 마음아 미안해 | 이별러들 위로하러 나타난 아연요정✨  딩고뮤직  live l 이별노래,조회수 16759회,430,13,2018. 11. 22.
312,구구단이 애교 넘치게 딩고를 부른 이유는｜들을수록｜gugudan,조회수 8372회,333,5,2018. 11. 21.
313,K-pop Playlist 기분전환 Refresh & Chill | 3 hours Mix 3시간 연속 재생 | 24/7 Live Stream | Dingo Music,조회수 12507회,547,6,2018. 11. 19.
314,스트레이키즈가 길거리 한복판에서 현타 맞은 이유는｜미래일기 스트레이키즈 편 티저,조회수 30340회,3.5천,11,2018. 11. 19.
315,십센치 권정열의 시발라드 ‘다 정한 이별’ 세로라이브Sero Live하상욱 x 권정열10cm - 다 정한 이별 expected farewell,조회수 427937회,6.5천,66,2018. 11. 16.
316,예고하상욱 x 권정열10cm 다 정한 이별 녹음현장,조회수 7305회,212,3,2018. 11. 15.
317,아련 보스 울보 '권정열10cmX하상욱시팔이 - 다 정한 이별expected farewell' 세로라이브 예고,조회수 17317회,403,2,2018. 11. 15.
318,이슬라이브 볼빨간사춘기 BOL4 - My Trouble | 이슬라이브 | Tipsy LIVE,조회수 51820회,1.1천,17,2018. 11. 15.
319,예고권정열10cmX하상욱 신곡 녹음 현장,조회수 12443회,352,1,2018. 11. 15.
320,Stray Kids 스트레이키즈 큐티뽀짝모먼트총모음 딩고 B컷 톡방 딩톡방,조회수 84231회,7.5천,15,2018. 11. 14.
321,여자친구 예린과 위키미키 유정이 세상 절친이었다니 근데 왜 갑자기 싸우고 그래ㅋㅋㅋ｜미래일기 예린&유정 티저｜GFRIEND WekiMeki,조회수 30202회,809,9,2018. 11. 12.
322,청순vs다크 스트레이 키즈의 존멋 댄스 Stray Kids - I am you @stage  딩고뮤직 dingo  댄스 dance l Stray kids,조회수 150704회,1.8만,26,2018. 11. 12.
323,세로라이브 안효성 레터 플로우 - 안부 A letter ​,조회수 23691회,365,7,2018. 11. 8.
324,눈물샘 자극하는 이별 띵곡 BEST 5 - 안효성 레터 플로우,조회수 13092회,246,5,2018. 11. 7.
325,청하CHUNG HA가 우리 학교에 온다면 | 내일을 응원해 | 딩고뮤직 | Dingo Music,조회수 866051회,1.4만,170,2018. 11. 7.
326,믿고듣는 멍믕지 꿀보이스 상자 The Box 라이브 | 정은지 Jeong Eun Ji | 딩고뮤직 | 수록곡 | 들을수록,조회수 63884회,3.2천,16,2018. 11. 6.
